{
 "ppi": 160,
 "scale": 0.6,
 "schema_version": "1.0",
 "sheets": {
  "de-calc-defaults": {
   "file": "de-calc-defaults.png",
   "hash": "d39a0660dfa15e05",
   "isolate": true,
   "size": [
    741,
    6111
   ]
  },
  "de-distance": {
   "file": "de-distance.png",
   "hash": "9a5acc7116cce864",
   "isolate": true,
   "size": [
    745,
    8308
   ]
  },
  "de-domain": {
   "file": "de-domain.png",
   "hash": "23b8f7f4aca5dedc",
   "isolate": true,
   "size": [
    739,
    2286
   ]
  },
  "de-domain-file": {
   "file": "de-domain-file.png",
   "hash": "886b8dcfbe4e74bc",
   "isolate": true,
   "size": [
    387,
    68
   ]
  },
  "de-eq": {
   "file": "de-eq.png",
   "hash": "3bb917dfd46b958e",
   "isolate": true,
   "size": [
    740,
    3011
   ]
  },
  "de-find": {
   "file": "de-find.png",
   "hash": "3aa41b023f0582b9",
   "isolate": true,
   "size": [
    750,
    3901
   ]
  },
  "de-fmt-decimals": {
   "file": "de-fmt-decimals.png",
   "hash": "b26a7a4d6a8438da",
   "isolate": true,
   "size": [
    61,
    120
   ]
  },
  "de-from-level": {
   "file": "de-from-level.png",
   "hash": "fe1fe5cf674ed60c",
   "isolate": true,
   "size": [
    542,
    491
   ]
  },
  "de-get": {
   "file": "de-get.png",
   "hash": "eb9b1533640edd75",
   "isolate": true,
   "size": [
    146,
    283
   ]
  },
  "de-ids": {
   "file": "de-ids.png",
   "hash": "988f5a2443d86a5a",
   "isolate": true,
   "size": [
    745,
    517
   ]
  },
  "de-image-fire-plan": {
   "file": "de-image-fire-plan.png",
   "hash": "c8877cc26483d432",
   "isolate": true,
   "size": [
    592,
    2332
   ]
  },
  "de-image-legend": {
   "file": "de-image-legend.png",
   "hash": "fb64ea3c75291c54",
   "isolate": true,
   "size": [
    518,
    1454
   ]
  },
  "de-image-polar-moment": {
   "file": "de-image-polar-moment.png",
   "hash": "d960fe4b9022eea3",
   "isolate": true,
   "size": [
    437,
    1533
   ]
  },
  "de-image-positions-plan": {
   "file": "de-image-positions-plan.png",
   "hash": "8ff27c15441c35aa",
   "isolate": true,
   "size": [
    473,
    3043
   ]
  },
  "de-image-schema": {
   "file": "de-image-schema.png",
   "hash": "de9d735124e8fe6b",
   "isolate": true,
   "size": [
    428,
    1083
   ]
  },
  "de-image-section": {
   "file": "de-image-section.png",
   "hash": "cb7c338aad8e1ac3",
   "isolate": true,
   "size": [
    329,
    1653
   ]
  },
  "de-image-static-model": {
   "file": "de-image-static-model.png",
   "hash": "c0d56a937c8b09d7",
   "isolate": true,
   "size": [
    371,
    842
   ]
  },
  "de-image-titleblock": {
   "file": "de-image-titleblock.png",
   "hash": "a32d741b52ec2d1f",
   "isolate": true,
   "size": [
    750,
    861
   ]
  },
  "de-journal-entries": {
   "file": "de-journal-entries.png",
   "hash": "2dad998018c0afc3",
   "isolate": true,
   "size": [
    82,
    148
   ]
  },
  "de-position": {
   "file": "de-position.png",
   "hash": "a46057752d542b85",
   "isolate": true,
   "size": [
    295,
    435
   ]
  },
  "de-set-report-language": {
   "file": "de-set-report-language.png",
   "hash": "6b3c2ad322e2d1d5",
   "isolate": true,
   "size": [
    741,
    259
   ]
  },
  "de-show-bibliography": {
   "file": "de-show-bibliography.png",
   "hash": "49e909a424de3ef6",
   "isolate": true,
   "size": [
    741,
    2527
   ]
  },
  "de-show-norm-list": {
   "file": "de-show-norm-list.png",
   "hash": "0a0315a04b6cfe58",
   "isolate": true,
   "size": [
    746,
    431
   ]
  },
  "de-t-of": {
   "file": "de-t-of.png",
   "hash": "896cf10dce7ac440",
   "isolate": true,
   "size": [
    139,
    106
   ]
  },
  "de-tl-of": {
   "file": "de-tl-of.png",
   "hash": "6027949032f5b7b4",
   "isolate": true,
   "size": [
    222,
    102
   ]
  },
  "de-unit": {
   "file": "de-unit.png",
   "hash": "d9ed379bd2fb69e8",
   "isolate": true,
   "size": [
    278,
    612
   ]
  },
  "de-var": {
   "file": "de-var.png",
   "hash": "207def68982fa296",
   "isolate": true,
   "size": [
    740,
    1891
   ]
  },
  "de-var-table": {
   "file": "de-var-table.png",
   "hash": "59f4d110fc11290e",
   "isolate": true,
   "size": [
    545,
    2893
   ]
  },
  "de-verify": {
   "file": "de-verify.png",
   "hash": "68eee303c9ef2450",
   "isolate": true,
   "size": [
    742,
    1576
   ]
  },
  "en-calc-defaults": {
   "file": "en-calc-defaults.png",
   "hash": "ff8537ce14746119",
   "isolate": true,
   "size": [
    741,
    6263
   ]
  },
  "en-distance": {
   "file": "en-distance.png",
   "hash": "a7cfdea2fd300f3d",
   "isolate": true,
   "size": [
    744,
    5369
   ]
  },
  "en-domain": {
   "file": "en-domain.png",
   "hash": "2442ff6c4df4ced9",
   "isolate": true,
   "size": [
    740,
    2272
   ]
  },
  "en-domain-file": {
   "file": "en-domain-file.png",
   "hash": "a82ff2f9ad08765b",
   "isolate": true,
   "size": [
    387,
    68
   ]
  },
  "en-eq": {
   "file": "en-eq.png",
   "hash": "5d65fcd4a1a1c779",
   "isolate": true,
   "size": [
    740,
    3016
   ]
  },
  "en-find": {
   "file": "en-find.png",
   "hash": "8c4744dabf61e482",
   "isolate": true,
   "size": [
    744,
    4119
   ]
  },
  "en-fmt-decimals": {
   "file": "en-fmt-decimals.png",
   "hash": "70b940010940930f",
   "isolate": true,
   "size": [
    61,
    120
   ]
  },
  "en-from-level": {
   "file": "en-from-level.png",
   "hash": "854659c5f29140b1",
   "isolate": true,
   "size": [
    520,
    491
   ]
  },
  "en-get": {
   "file": "en-get.png",
   "hash": "890607d8d1a8089b",
   "isolate": true,
   "size": [
    137,
    288
   ]
  },
  "en-ids": {
   "file": "en-ids.png",
   "hash": "ee8335b9a5332e58",
   "isolate": true,
   "size": [
    745,
    517
   ]
  },
  "en-image-fire-plan": {
   "file": "en-image-fire-plan.png",
   "hash": "f0b72965a88c546a",
   "isolate": true,
   "size": [
    593,
    2332
   ]
  },
  "en-image-legend": {
   "file": "en-image-legend.png",
   "hash": "10dcf808c9a1ee43",
   "isolate": true,
   "size": [
    518,
    1454
   ]
  },
  "en-image-polar-moment": {
   "file": "en-image-polar-moment.png",
   "hash": "4fa3c13da1decd15",
   "isolate": true,
   "size": [
    437,
    1533
   ]
  },
  "en-image-positions-plan": {
   "file": "en-image-positions-plan.png",
   "hash": "6e27a25d49c10782",
   "isolate": true,
   "size": [
    484,
    3043
   ]
  },
  "en-image-schema": {
   "file": "en-image-schema.png",
   "hash": "408b270bbcd5cdf9",
   "isolate": true,
   "size": [
    428,
    1083
   ]
  },
  "en-image-section": {
   "file": "en-image-section.png",
   "hash": "8fd8cafe99a06f74",
   "isolate": true,
   "size": [
    329,
    1653
   ]
  },
  "en-image-static-model": {
   "file": "en-image-static-model.png",
   "hash": "5a321721150d898e",
   "isolate": true,
   "size": [
    371,
    842
   ]
  },
  "en-image-titleblock": {
   "file": "en-image-titleblock.png",
   "hash": "de9a42cf137cae6b",
   "isolate": true,
   "size": [
    750,
    861
   ]
  },
  "en-journal-entries": {
   "file": "en-journal-entries.png",
   "hash": "a04908ab6e26b8a5",
   "isolate": true,
   "size": [
    82,
    148
   ]
  },
  "en-position": {
   "file": "en-position.png",
   "hash": "e467fa333f191125",
   "isolate": true,
   "size": [
    287,
    431
   ]
  },
  "en-set-report-language": {
   "file": "en-set-report-language.png",
   "hash": "7fd84359eb9564dc",
   "isolate": true,
   "size": [
    741,
    259
   ]
  },
  "en-show-bibliography": {
   "file": "en-show-bibliography.png",
   "hash": "03135e3c27364a84",
   "isolate": true,
   "size": [
    746,
    2527
   ]
  },
  "en-show-norm-list": {
   "file": "en-show-norm-list.png",
   "hash": "f3ce3db74eb394a7",
   "isolate": true,
   "size": [
    746,
    431
   ]
  },
  "en-t-of": {
   "file": "en-t-of.png",
   "hash": "9c61ec3d154669bf",
   "isolate": true,
   "size": [
    139,
    106
   ]
  },
  "en-tl-of": {
   "file": "en-tl-of.png",
   "hash": "d0a53a969646fd85",
   "isolate": true,
   "size": [
    222,
    102
   ]
  },
  "en-unit": {
   "file": "en-unit.png",
   "hash": "4cb6d92306a2a3c3",
   "isolate": true,
   "size": [
    278,
    612
   ]
  },
  "en-var": {
   "file": "en-var.png",
   "hash": "efa80db411311103",
   "isolate": true,
   "size": [
    740,
    1897
   ]
  },
  "en-var-table": {
   "file": "en-var-table.png",
   "hash": "74db9ffcaa473026",
   "isolate": true,
   "size": [
    536,
    2893
   ]
  },
  "en-verify": {
   "file": "en-verify.png",
   "hash": "ef5fb7def47b4d3f",
   "isolate": true,
   "size": [
    742,
    1552
   ]
  },
  "fr-calc-defaults": {
   "file": "fr-calc-defaults.png",
   "hash": "ec521e40477885ff",
   "isolate": true,
   "size": [
    741,
    6111
   ]
  },
  "fr-distance": {
   "file": "fr-distance.png",
   "hash": "a74b7a7a83c2b3a2",
   "isolate": true,
   "size": [
    744,
    5380
   ]
  },
  "fr-domain": {
   "file": "fr-domain.png",
   "hash": "1d2bfc2fd407a705",
   "isolate": true,
   "size": [
    740,
    2272
   ]
  },
  "fr-domain-file": {
   "file": "fr-domain-file.png",
   "hash": "490b42649821e32d",
   "isolate": true,
   "size": [
    387,
    68
   ]
  },
  "fr-eq": {
   "file": "fr-eq.png",
   "hash": "5f34c2e0a7ad7870",
   "isolate": true,
   "size": [
    740,
    2969
   ]
  },
  "fr-find": {
   "file": "fr-find.png",
   "hash": "4446da1872ac74ea",
   "isolate": true,
   "size": [
    744,
    4754
   ]
  },
  "fr-fmt-decimals": {
   "file": "fr-fmt-decimals.png",
   "hash": "18f4d33eea051af5",
   "isolate": true,
   "size": [
    61,
    120
   ]
  },
  "fr-from-level": {
   "file": "fr-from-level.png",
   "hash": "63329d32bbf08c87",
   "isolate": true,
   "size": [
    542,
    491
   ]
  },
  "fr-get": {
   "file": "fr-get.png",
   "hash": "de37667a723e0524",
   "isolate": true,
   "size": [
    241,
    288
   ]
  },
  "fr-ids": {
   "file": "fr-ids.png",
   "hash": "0051de8f2ca7561c",
   "isolate": true,
   "size": [
    745,
    517
   ]
  },
  "fr-image-fire-plan": {
   "file": "fr-image-fire-plan.png",
   "hash": "88364d4d9d7380f7",
   "isolate": true,
   "size": [